{
  "$schema": "https://json-schema.org/draft/2020-12/schema",
  "$id": "urn:dla:contracts:interface-b.v1.schema.json",
  "title": "Interface B v1: forecast feed (backend to agent)",
  "description": "Today's hourly distraction risk, for the agent to cache so that nudges keep working with no internet. Spec: FR-20 (hourly risk for today, trains after 14 days), FR-21 (nudge about 5 minutes before a predicted high-risk window, with a suggested focus block), FR-15 (best focus hours, weekday/weekend separated), risks table ('smart defaults', show confidence, start forecast at day 14). The agent decides when and whether to nudge; this feed carries no nudge limits (2/day, cooldown after 2 ignores are agent-side).",
  "type": "object",
  "additionalProperties": false,
  "required": ["schema_version", "device_id", "generated_at", "feed_version", "valid_until", "status"],
  "properties": {
    "schema_version": { "const": "interface-b.v1" },
    "device_id": { "$ref": "#/$defs/uuid" },
    "generated_at": { "$ref": "#/$defs/utcTimestamp" },
    "feed_version": {
      "description": "Increases with every new feed for this device. Used as the ETag so the agent can ask 'anything newer?' cheaply.",
      "type": "integer",
      "minimum": 1
    },
    "valid_until": {
      "description": "The agent may nudge from this cached feed until this moment, offline or not. What happens after expiry (no nudges?) and who chooses the lifetime is OQ-B3.",
      "x-open-question": "OQ-B3",
      "$ref": "#/$defs/utcTimestamp"
    },
    "status": {
      "description": "ready: a forecast is included. insufficient_data: fewer than 14 days of data, no forecast yet (the spec waits for at least 14 days).",
      "enum": ["ready", "insufficient_data"]
    },
    "days_of_data": { "type": "integer", "minimum": 0 },
    "source": {
      "description": "personal_model: the per-user model (FR-20). smart_defaults: aggregated patterns shipped while data is thin (risks table). Whether smart defaults reach the agent through this feed is OQ-B1.",
      "x-open-question": "OQ-B1",
      "enum": ["personal_model", "smart_defaults"]
    },
    "model_version": { "type": "string", "minLength": 1, "maxLength": 32, "pattern": "^[A-Za-z0-9._-]+$" },
    "timezone": {
      "description": "IANA zone name (for example Asia/Karachi), so the local day and DST are unambiguous.",
      "type": "string",
      "maxLength": 64,
      "pattern": "^[A-Za-z_]+(/[A-Za-z0-9_+-]+)*$"
    },
    "forecast_date": {
      "description": "The local calendar date the hours belong to. Horizon is today only in this version (OQ-B4).",
      "x-open-question": "OQ-B4",
      "type": "string",
      "pattern": "^\\d{4}-\\d{2}-\\d{2}$"
    },
    "hours": {
      "description": "Risk for each hour of forecast_date. Up to 25 entries to allow a DST day.",
      "type": "array",
      "maxItems": 25,
      "items": {
        "type": "object",
        "additionalProperties": false,
        "required": ["hour_start", "risk", "confidence", "high_risk"],
        "properties": {
          "hour_start": {
            "type": "string",
            "format": "date-time",
            "pattern": "^\\d{4}-\\d{2}-\\d{2}T\\d{2}:00:00Z$"
          },
          "risk": { "description": "Predicted distraction risk, 0 to 1.", "type": "number", "minimum": 0, "maximum": 1 },
          "confidence": { "description": "How sure the model is about this hour, 0 to 1 (spec: show confidence).", "type": "number", "minimum": 0, "maximum": 1 },
          "high_risk": {
            "description": "True if this hour is flagged as a high-risk window (the hours whose precision FR-20 measures). Who owns the flag threshold is OQ-B6.",
            "x-open-question": "OQ-B6",
            "type": "boolean"
          }
        }
      }
    },
    "focus_windows": {
      "description": "Detected best focus hours (FR-15), weekday and weekend separately, as local minutes of the day. The agent needs a suggested focus block for each nudge (FR-21); the spec does not say who proposes it: OQ-B2. Optional.",
      "x-open-question": "OQ-B2",
      "type": "array",
      "maxItems": 14,
      "items": {
        "type": "object",
        "additionalProperties": false,
        "required": ["day_type", "start_minute_of_day", "end_minute_of_day"],
        "properties": {
          "day_type": { "enum": ["weekday", "weekend"] },
          "start_minute_of_day": { "type": "integer", "minimum": 0, "maximum": 1439 },
          "end_minute_of_day": { "type": "integer", "minimum": 1, "maximum": 1440 }
        }
      }
    }
  },
  "allOf": [
    {
      "if": { "properties": { "status": { "const": "ready" } } },
      "then": { "required": ["timezone", "forecast_date", "source", "model_version", "hours"], "properties": { "hours": { "minItems": 1 } } }
    },
    {
      "if": { "properties": { "status": { "const": "insufficient_data" } } },
      "then": { "required": ["days_of_data"], "properties": { "hours": { "maxItems": 0 } } }
    }
  ],
  "$defs": {
    "uuid": { "type": "string", "pattern": "^[0-9a-f]{8}-[0-9a-f]{4}-[0-9a-f]{4}-[0-9a-f]{4}-[0-9a-f]{12}$" },
    "utcTimestamp": {
      "type": "string",
      "format": "date-time",
      "pattern": "^\\d{4}-\\d{2}-\\d{2}T\\d{2}:\\d{2}:\\d{2}(\\.\\d{1,3})?Z$"
    }
  }
}
