{
  "schema_version": "interface-b.v1",
  "device_id": "b7a2f0c4-91d3-4e68-8f1a-5c3d7e9b2a10",
  "generated_at": "2026-10-09T02:00:00Z",
  "feed_version": 17,
  "valid_until": "2026-10-10T02:00:00Z",
  "status": "ready",
  "days_of_data": 21,
  "source": "personal_model",
  "model_version": "2026.10.1",
  "timezone": "Asia/Karachi",
  "forecast_date": "2026-10-09",
  "hours": [
    { "hour_start": "2026-10-09T05:00:00Z", "risk": 0.12, "confidence": 0.8, "high_risk": false },
    { "hour_start": "2026-10-09T06:00:00Z", "risk": 0.71, "confidence": 0.64, "high_risk": true },
    { "hour_start": "2026-10-09T07:00:00Z", "risk": 0.35, "confidence": 0.7, "high_risk": false }
  ],
  "focus_windows": [
    { "day_type": "weekday", "start_minute_of_day": 540, "end_minute_of_day": 660 },
    { "day_type": "weekend", "start_minute_of_day": 600, "end_minute_of_day": 720 }
  ]
}
